{
  "$comment": "Requirement IDs: HEE-SHOW-01, HEE-SHOW-02, HEE-SHOW-03, HEE-SHOW-04, HEE-CLAIM-01 | Owned by DP-W09 | 3 steps, 2 stills and a hero.",
  "version": "1.0.0",
  "base_url": "http://127.0.0.1:4310",
  "viewport": { "width": 1440, "height": 900 },
  "steps": [
    { "id": "open", "title": "Open the shelf", "actions": [{ "route": "/" }], "settle_ms": 200 },
    {
      "id": "label",
      "title": "Label the shelf",
      "actions": [{ "type": { "label": "Shelf", "value": "B" } }, { "expect_text": "Shelf" }],
      "settle_ms": 200
    },
    {
      "id": "move",
      "title": "Move the widget",
      "actions": [{ "click": "Move to B", "role": "button" }, { "expect_text": "Shelf B: blue widget" }],
      "settle_ms": 300
    }
  ],
  "stills": [
    {
      "id": "shelf-before",
      "after_step": "label",
      "selector": null,
      "claim": "The shelf before the move, labelled and ready.",
      "claim_id": null,
      "alt": "The shelf before the move"
    },
    {
      "id": "shelf-after",
      "after_step": "move",
      "selector": null,
      "claim": "The shelf after the agent moves the blue widget to shelf B.",
      "claim_id": null,
      "alt": "The shelf after the move"
    }
  ],
  "hero": { "from_step": "label", "to_step": "move" }
}
