{
  "version": "1.0.0",
  "base_url": "http://127.0.0.1:8080",
  "viewport": { "width": 1280, "height": 720 },
  "steps": [
    { "id": "open", "title": "Open the page", "actions": [{ "route": "/" }, { "expect_text": "Load the sample week" }], "settle_ms": 800 },
    { "id": "week", "title": "Load the sample week", "actions": [{ "click": "Load the sample week", "role": "button" }, { "wait_ms": 12000 }, { "expect_text": "Sample week" }], "settle_ms": 600 },
    { "id": "review", "title": "Start the review", "actions": [{ "click": "Review the week", "role": "button" }, { "wait_ms": 25000 }], "settle_ms": 500 },
    { "id": "approve", "title": "Approve the request", "actions": [{ "click": "Approve", "role": "button" }, { "wait_ms": 8000 }], "settle_ms": 800 },
    { "id": "circle", "title": "Open the circled moment", "actions": [{ "click": "Open incident", "role": "button" }, { "wait_ms": 800 }], "settle_ms": 600 },
    { "id": "walk", "title": "Walk through the door", "actions": [{ "play3d": "walk" }, { "wait_ms": 1500 }], "settle_ms": 600 },
    { "id": "focus", "title": "Frame the moment", "actions": [{ "click": "Focus", "role": "button" }, { "wait_ms": 1500 }], "settle_ms": 600 },
    { "id": "dusk", "title": "The evening look", "actions": [{ "click": "Dusk", "role": "radio" }, { "wait_ms": 600 }], "settle_ms": 600 }
  ],
  "stills": [
    { "id": "week", "after_step": "week", "selector": null, "claim": "Seven days of Rosa's front door drawn as a paper calendar with every visit marked.", "claim_id": null, "alt": "The week as a paper calendar" },
    { "id": "agent", "after_step": "review", "selector": "[data-run-phase]", "claim": "The agent reads the week and checks each day while every step is listed as it happens.", "claim_id": null, "alt": "The agent panel mid-review" },
    { "id": "approval", "after_step": "review", "selector": "[data-result-region=\"approval-bar\"]", "claim": "Before anything reaches Marta the review waits for a person to press Approve or Reject.", "claim_id": null, "alt": "The approval request" },
    { "id": "circle", "after_step": "circle", "selector": null, "claim": "The one moment that did not fit the routine is circled in pencil on its day.", "claim_id": null, "alt": "The circled moment" },
    { "id": "stage", "after_step": "focus", "selector": "[data-result-region=\"scene-3d\"]", "claim": "The same week stands up in three dimensions with the circled moment framed.", "claim_id": null, "alt": "The 3D view focused on the moment" },
    { "id": "dusk", "after_step": "dusk", "selector": null, "claim": "The page has a calmer second look for the evening, switched with one control.", "claim_id": null, "alt": "The page in the evening look" }
  ],
  "hero": { "from_step": "review", "to_step": "approve" }
}
